{
  "version": 1,
  "generated_for": "health-002",
  "last_checked_at": "2026-07-08",
  "scope_note": "First canonical registry seed for the Philippines insurance and HMO navigator. PhilHealth is the primary anchor, HMOs are seeded from the Insurance Commission HMO Certificate of Authority list, and major insurance companies are initial seeds for later verification and extraction.",
  "advice_boundary": "Educational workflow data only. This registry does not provide medical advice, insurance advice, legal advice, financial advice, claims decisions, coverage determinations, rankings, or purchase recommendations.",
  "sources": [
    {
      "source_id": "philhealth-benefits",
      "source_type": "public-payer",
      "title": "PhilHealth Benefits",
      "url": "https://www.philhealth.gov.ph/benefits/",
      "authority_level": "official",
      "last_checked_at": "2026-07-08",
      "notes": "Official PhilHealth benefits surface used as the public health insurance anchor."
    },
    {
      "source_id": "ic-hmo-ca-2025-11-30",
      "source_type": "regulator",
      "title": "Insurance Commission list of HMOs with Certificates of Authority as of 30 November 2025",
      "url": "https://www.insurance.gov.ph/wp-content/uploads/2025/10/List-of-Health-Maintenance-Organizations-with-Certificates-of-Authority-issued-by-the-Insurance-Commission-As-of-30-November-2025.pdf",
      "authority_level": "official",
      "last_checked_at": "2026-07-08",
      "notes": "Official HMO entity seed source."
    },
    {
      "source_id": "ic-hmo-product-circular-2017-19",
      "source_type": "regulator",
      "title": "Insurance Commission Circular Letter 2017-19 on HMO products and forms",
      "url": "https://www.insurance.gov.ph/wp-content/uploads/2022/09/CL2017_19.pdf",
      "authority_level": "official",
      "last_checked_at": "2026-07-08",
      "notes": "Official HMO product definition and product-approval source."
    },
    {
      "source_id": "ic-insurance-ca-2025-12-31",
      "source_type": "regulator",
      "title": "Insurance Commission list of insurance companies with valid and existing Certificate of Authority as of 31 December 2025",
      "url": "https://www.insurance.gov.ph/wp-content/uploads/2025/10/List-of-Insurance-Companies-with-Valid-and-Existing-CA-as-of-31-December-2025.pdf",
      "authority_level": "official",
      "last_checked_at": "2026-07-08",
      "notes": "Official insurance-company seed source."
    },
    {
      "source_id": "ic-life-premium-income-2025",
      "source_type": "market-performance",
      "title": "Insurance Commission performance of life insurance companies by premium income as of 31 December 2025",
      "url": "https://www.insurance.gov.ph/wp-content/uploads/2026/02/Performance-of-Life-Insurance-Companies-Premium-Income-as-of-31-December-2025-Based-on-Submitted-Unaudited-EQRSFS.pdf",
      "authority_level": "official",
      "last_checked_at": "2026-07-08",
      "notes": "Used only to seed major life-insurer candidates, not to recommend products."
    },
    {
      "source_id": "ic-nonlife-gpw-2025",
      "source_type": "market-performance",
      "title": "Insurance Commission gross premiums written of non-life insurance companies as of 31 December 2025",
      "url": "https://www.insurance.gov.ph/wp-content/uploads/2026/02/Performance-of-Non-Life-Insurance-Companies-GPW-as-of-31-December-2025-Based-on-Submitted-Unaudited-EQRSFS.pdf",
      "authority_level": "official",
      "last_checked_at": "2026-07-08",
      "notes": "Used only to seed major non-life-insurer candidates, not to recommend products."
    }
  ],
  "entities": [
    {
      "entity_id": "philhealth",
      "entity_type": "public-payer",
      "canonical_name": "Philippine Health Insurance Corporation",
      "display_name": "PhilHealth",
      "legal_name": "Philippine Health Insurance Corporation",
      "brand_names": ["PhilHealth"],
      "former_names": [],
      "aliases": ["PhilHealth", "Philippine Health Insurance Corporation"],
      "country": "Philippines",
      "priority": "primary",
      "status": "official-anchor",
      "source_ids": ["philhealth-benefits"],
      "official_domains": ["philhealth.gov.ph"],
      "notes": "Primary public health insurance anchor for navigator workflows.",
      "last_checked_at": "2026-07-08"
    },
    {
      "entity_id": "asalus-corporation",
      "entity_type": "hmo",
      "canonical_name": "Asalus Corporation",
      "display_name": "Intellicare",
      "legal_name": "Asalus Corporation",
      "brand_names": ["Intellicare"],
      "former_names": [],
      "aliases": ["Asalus Corporation", "Intellicare", "The Intellicare Group"],
      "country": "Philippines",
      "priority": "secondary",
      "status": "listed",
      "source_ids": ["ic-hmo-ca-2025-11-30"],
      "official_domains": ["intellicare.com.ph"],
      "notes": "HMO entity listed by the Insurance Commission; brand commonly appears as Intellicare.",
      "last_checked_at": "2026-07-08"
    },
    {
      "entity_id": "asiancare-health-systems",
      "entity_type": "hmo",
      "canonical_name": "Asiancare Health Systems, Inc.",
      "display_name": "Asiancare Health Systems",
      "legal_name": "Asiancare Health Systems, Inc.",
      "brand_names": [],
      "former_names": [],
      "aliases": ["Asiancare Health Systems", "Asiancare Health Systems, Inc."],
      "country": "Philippines",
      "priority": "secondary",
      "status": "listed",
      "source_ids": ["ic-hmo-ca-2025-11-30"],
      "official_domains": [],
      "last_checked_at": "2026-07-08"
    },
    {
      "entity_id": "avega-managed-care",
      "entity_type": "hmo",
      "canonical_name": "Avega Managed Care, Inc.",
      "display_name": "Avega Managed Care",
      "legal_name": "Avega Managed Care, Inc.",
      "brand_names": ["Avega"],
      "former_names": [],
      "aliases": ["Avega", "Avega Managed Care", "Avega Managed Care, Inc."],
      "country": "Philippines",
      "priority": "secondary",
      "status": "listed",
      "source_ids": ["ic-hmo-ca-2025-11-30"],
      "official_domains": [],
      "last_checked_at": "2026-07-08"
    },
    {
      "entity_id": "carewell-health-systems",
      "entity_type": "hmo",
      "canonical_name": "Carewell Health Systems, Inc.",
      "display_name": "Carewell Health Systems",
      "legal_name": "Carewell Health Systems, Inc.",
      "brand_names": [],
      "former_names": [],
      "aliases": ["Carewell Health Systems", "Carewell Health Systems, Inc."],
      "country": "Philippines",
      "priority": "secondary",
      "status": "listed",
      "source_ids": ["ic-hmo-ca-2025-11-30"],
      "official_domains": [],
      "last_checked_at": "2026-07-08"
    },
    {
      "entity_id": "cooperative-health-management-federation",
      "entity_type": "hmo",
      "canonical_name": "Cooperative Health Management Federation",
      "display_name": "Cooperative Health Management Federation",
      "legal_name": "Cooperative Health Management Federation",
      "brand_names": [],
      "former_names": [],
      "aliases": ["Cooperative Health Management Federation"],
      "country": "Philippines",
      "priority": "secondary",
      "status": "listed",
      "source_ids": ["ic-hmo-ca-2025-11-30"],
      "official_domains": [],
      "last_checked_at": "2026-07-08"
    },
    {
      "entity_id": "dynamic-care-corporation",
      "entity_type": "hmo",
      "canonical_name": "Dynamic Care Corporation",
      "display_name": "Dynamic Care Corporation",
      "legal_name": "Dynamic Care Corporation",
      "brand_names": [],
      "former_names": [],
      "aliases": ["Dynamic Care Corporation"],
      "country": "Philippines",
      "priority": "secondary",
      "status": "listed",
      "source_ids": ["ic-hmo-ca-2025-11-30"],
      "official_domains": [],
      "last_checked_at": "2026-07-08"
    },
    {
      "entity_id": "eastwest-healthcare",
      "entity_type": "hmo",
      "canonical_name": "EastWest Healthcare, Inc.",
      "display_name": "EastWest Healthcare",
      "legal_name": "EastWest Healthcare, Inc.",
      "brand_names": [],
      "former_names": [],
      "aliases": ["EastWest Healthcare", "EastWest Healthcare, Inc."],
      "country": "Philippines",
      "priority": "secondary",
      "status": "listed",
      "source_ids": ["ic-hmo-ca-2025-11-30"],
      "official_domains": [],
      "last_checked_at": "2026-07-08"
    },
    {
      "entity_id": "forticare-health-systems-international",
      "entity_type": "hmo",
      "canonical_name": "Forticare Health Systems International, Inc.",
      "display_name": "Forticare Health Systems International",
      "legal_name": "Forticare Health Systems International, Inc.",
      "brand_names": ["Forticare"],
      "former_names": [],
      "aliases": ["Forticare", "Forticare Health Systems International", "Forticare Health Systems International, Inc."],
      "country": "Philippines",
      "priority": "secondary",
      "status": "listed",
      "source_ids": ["ic-hmo-ca-2025-11-30"],
      "official_domains": [],
      "last_checked_at": "2026-07-08"
    },
    {
      "entity_id": "getwell-health-system",
      "entity_type": "hmo",
      "canonical_name": "Getwell Health System, Inc.",
      "display_name": "Getwell Health System",
      "legal_name": "Getwell Health System, Inc.",
      "brand_names": ["Getwell"],
      "former_names": [],
      "aliases": ["Getwell", "Getwell Health System", "Getwell Health System, Inc."],
      "country": "Philippines",
      "priority": "secondary",
      "status": "listed-with-regulatory-note",
      "source_ids": ["ic-hmo-ca-2025-11-30"],
      "official_domains": [],
      "notes": "The source PDF includes a regulatory footnote near this entry; verify current status before consumer-facing use.",
      "last_checked_at": "2026-07-08"
    },
    {
      "entity_id": "health-care-and-development-corporation-of-the-philippines",